"Story","Title","Result","Date","Stability","Duration (s)"
"Create student data driven test","Data Driven test for Adding multpile Student","FAILURE","2018-08-12T22:36:09.643-06:00","0.0","5.68"
"Serenity id info","This is failing test","FAILURE","2018-08-12T22:35:51.222-06:00","0.0","3.43"
"First serenity test","This is failing test","FAILURE","2018-08-12T22:36:46.859-06:00","0.0","3.43"
"Serenity id info","This test cause error","ERROR","2018-08-12T22:35:46.027-06:00","0.0","2.64"
"First serenity test","This test cause error","ERROR","2018-08-12T22:36:39.909-06:00","0.0","3.44"
